{
  "$schema": "https://json.schemastore.org/claude-code-marketplace.json",
  "name": "kapso",
  "version": "0.1.0",
  "description": "Kapso plugins for Claude Code, including WhatsApp automation, Project Event workflows, integration, log search, and observability skills.",
  "owner": {
    "name": "Kapso",
    "url": "https://kapso.ai"
  },
  "plugins": [
    {
      "name": "kapso",
      "description": "Build, integrate, search logs, and observe Kapso WhatsApp automations and Project Event workflows.",
      "version": "0.1.0",
      "author": {
        "name": "Kapso",
        "url": "https://kapso.ai"
      },
      "source": "./plugins/kapso",
      "category": "development",
      "homepage": "https://kapso.ai"
    }
  ]
}
